{
  "policy_id": "bayanat-norm-v1",
  "version": 1,
  "spec": "arabic-normalize-spec-1",
  "unicode_version": "18.0.0",
  "unicode_form": "NFC",
  "idempotent": true,
  "stages": {
    "reject_invalid": "drop",
    "strip_controls": "strip",
    "presentation_forms": "map",
    "ligatures_honorific": "flag",
    "bidi_zw": "strip-except-meaningful",
    "tatweel": "strip",
    "diacritics": "strip",
    "quranic_marks": "strip",
    "superscript_alef": "strip",
    "alef_variants": "map",
    "alef_maqsura": "to-yeh",
    "taa_marbuta": "flag",
    "hamza_carriers": "keep",
    "persian_urdu_letters": "keep",
    "digits": "ascii",
    "punctuation": "keep",
    "whitespace": "keep",
    "latin_case": "keep"
  },
  "meta": {
    "title_en": "Bayanat Labs standard Arabic text normalisation, version 1",
    "title_ar": "التوحيد القياسي للنص العربي من بيانات لابز، الإصدار 1",
    "description_en": "Default policy for text_norm columns in Bayanat Labs datasets. NFC plus mapping of Arabic presentation forms; invisible controls removed except a meaningful ZWNJ or emoji ZWJ; tatweel, harakat, Quranic marks and superscript alef removed; alef variants to bare alef; alef maqsura to yeh; taa marbuta kept and flagged; Arabic-Indic and Extended Arabic-Indic digits to ASCII; honorific ligatures kept and flagged.",
    "license": "CC-BY-4.0",
    "attribution": "Bayanat Labs (https://bayanatlabs.com)",
    "created": "2026-10-15",
    "status": "pilot"
  }
}
